iterationName	gameid	time	trialNum	trialType	targetGoalSet	distractorGoalSet	text	timeFromRoundStart	eventType
full_sample	3127-34ebbc7f-b293-4bf3-8a08-0f560874be62	1546220914980	0	catch	10H	8D	Where is the where is the 10 of heart?	13144	chatMessage
full_sample	3127-34ebbc7f-b293-4bf3-8a08-0f560874be62	1546220978001	1	baseline	QH,2C	9H,5D	Where is the where are the 2 of clubs and queen of hearts?	33170	chatMessage
full_sample	3127-34ebbc7f-b293-4bf3-8a08-0f560874be62	1546221043239	2	baseline	6H,AD	QH,4C	Where is the where are the ace of spade and the 6 of heart?	33625	chatMessage
full_sample	3127-34ebbc7f-b293-4bf3-8a08-0f560874be62	1546221092468	2	baseline	6H,AD	QH,4C	Where is the ace of spade and 6 heart?	11009	chatMessage
full_sample	3127-34ebbc7f-b293-4bf3-8a08-0f560874be62	1546221180424	2	baseline	6H,AD	QH,4C	Where is the A of spade?	10008	chatMessage
full_sample	3127-34ebbc7f-b293-4bf3-8a08-0f560874be62	1546221208141	2	baseline	6H,AD	QH,4C	Where is the a of diamond?	12898	chatMessage
full_sample	3127-34ebbc7f-b293-4bf3-8a08-0f560874be62	1546221241049	2	baseline	6H,AD	QH,4C	Where is the A of Diamond?	9921	chatMessage
